{
  "$schema": "./interior-tactical-model-packs.v1.schema.json",
  "schemaVersion": 1,
  "catalogId": "massfront-interior-tactical-model-packs-v1",
  "status": "PLANNED",
  "runtimeReady": false,
  "units": "meters",
  "coordinateContract": {
    "upAxis": "+Y",
    "forwardAxis": "+Z",
    "origin": "floor-center",
    "detailSnap": 0.5,
    "structuralSnap": 4,
    "verticalSnap": 4
  },
  "mobilityClasses": {
    "infantry": {
      "agentEnvelope": [1.2, 2.4, 1.2],
      "minimumPortal": [1.6, 2.8, 0.5],
      "minimumTurnDiameter": 1.8,
      "maximumStep": 0.35,
      "maximumRampDegrees": 20
    },
    "small_vehicle": {
      "agentEnvelope": [3.2, 2.6, 5.5],
      "minimumPortal": [4, 3.2, 1],
      "minimumTurnDiameter": 7,
      "maximumStep": 0.18,
      "maximumRampDegrees": 12
    },
    "mech": {
      "agentEnvelope": [5.5, 5.4, 4.5],
      "minimumPortal": [6, 5.8, 1.5],
      "minimumTurnDiameter": 9,
      "maximumStep": 0.5,
      "maximumRampDegrees": 15
    }
  },
  "socketProfiles": {
    "interior_personnel_4x4": {
      "openingWidth": 4,
      "openingHeight": 4,
      "clearWidth": 3.2,
      "clearHeight": 3.2,
      "mobility": ["infantry"]
    },
    "interior_mixed_8x6": {
      "openingWidth": 8,
      "openingHeight": 6,
      "clearWidth": 6.4,
      "clearHeight": 5.8,
      "mobility": ["infantry", "small_vehicle", "mech"]
    },
    "interior_vertical_8x6": {
      "openingWidth": 8,
      "openingHeight": 6,
      "clearWidth": 6.4,
      "clearHeight": 5.8,
      "mobility": ["infantry", "small_vehicle", "mech"]
    }
  },
  "assetArchetypes": {
    "room_4x4": {
      "category": "room",
      "sizeMeters": [4, 4, 4],
      "pivot": "floor-center",
      "tileable": true,
      "socketProfiles": ["interior_personnel_4x4"],
      "lodTriangleBudget": { "lod0": 12000, "lod1": 5000, "lod2": 1800 },
      "collision": { "kind": "primitive-plus-blockers", "maximumHulls": 8, "separateFromRenderMesh": true },
      "nav": { "walkable": true, "carvesNav": false, "mobility": ["infantry"], "clearanceRule": "Maintain a continuous 1.6 m by 2.8 m personnel path between every declared socket." },
      "damageStates": ["intact", "damaged", "destroyed"]
    },
    "room_8x8": {
      "category": "room",
      "sizeMeters": [8, 6, 8],
      "pivot": "floor-center",
      "tileable": true,
      "socketProfiles": ["interior_personnel_4x4", "interior_mixed_8x6"],
      "lodTriangleBudget": { "lod0": 22000, "lod1": 9000, "lod2": 3000 },
      "collision": { "kind": "primitive-plus-blockers", "maximumHulls": 12, "separateFromRenderMesh": true },
      "nav": { "walkable": true, "carvesNav": false, "mobility": ["infantry", "small_vehicle", "mech"], "clearanceRule": "Keep a 6.4 m mixed-mobility lane and a 9 m turning pocket free of decorative geometry." },
      "damageStates": ["intact", "damaged", "destroyed"]
    },
    "corridor_4x8_straight": {
      "category": "corridor",
      "sizeMeters": [4, 4, 8],
      "pivot": "floor-center",
      "tileable": true,
      "socketProfiles": ["interior_personnel_4x4"],
      "lodTriangleBudget": { "lod0": 9000, "lod1": 3600, "lod2": 1200 },
      "collision": { "kind": "box-compound", "maximumHulls": 6, "separateFromRenderMesh": true },
      "nav": { "walkable": true, "carvesNav": false, "mobility": ["infantry"], "clearanceRule": "No prop may reduce the 3.2 m clear lane; visual ribs must remain outside navigation clearance." },
      "damageStates": ["intact", "damaged", "destroyed"]
    },
    "corridor_4x4_corner": {
      "category": "corridor",
      "sizeMeters": [4, 4, 4],
      "pivot": "floor-center",
      "tileable": true,
      "socketProfiles": ["interior_personnel_4x4"],
      "lodTriangleBudget": { "lod0": 8000, "lod1": 3200, "lod2": 1000 },
      "collision": { "kind": "box-compound", "maximumHulls": 6, "separateFromRenderMesh": true },
      "nav": { "walkable": true, "carvesNav": false, "mobility": ["infantry"], "clearanceRule": "Corner inner radius must preserve a 1.8 m infantry turning diameter." },
      "damageStates": ["intact", "damaged", "destroyed"]
    },
    "corridor_8x8_straight": {
      "category": "corridor",
      "sizeMeters": [8, 6, 8],
      "pivot": "floor-center",
      "tileable": true,
      "socketProfiles": ["interior_mixed_8x6"],
      "lodTriangleBudget": { "lod0": 15000, "lod1": 6000, "lod2": 2000 },
      "collision": { "kind": "box-compound", "maximumHulls": 8, "separateFromRenderMesh": true },
      "nav": { "walkable": true, "carvesNav": false, "mobility": ["infantry", "small_vehicle", "mech"], "clearanceRule": "Preserve the full 6.4 m by 5.8 m clear mixed lane from socket plane to socket plane." },
      "damageStates": ["intact", "damaged", "destroyed"]
    },
    "junction_8x8": {
      "category": "junction",
      "sizeMeters": [8, 6, 8],
      "pivot": "floor-center",
      "tileable": true,
      "socketProfiles": ["interior_mixed_8x6"],
      "lodTriangleBudget": { "lod0": 18000, "lod1": 7200, "lod2": 2400 },
      "collision": { "kind": "primitive-plus-blockers", "maximumHulls": 10, "separateFromRenderMesh": true },
      "nav": { "walkable": true, "carvesNav": false, "mobility": ["infantry", "small_vehicle", "mech"], "clearanceRule": "All declared branches meet through a central 9 m turning pocket; corner props are non-blocking or destructible." },
      "damageStates": ["intact", "damaged", "destroyed"]
    },
    "vertical_link_8x8": {
      "category": "vertical-link",
      "sizeMeters": [8, 6, 8],
      "pivot": "floor-center",
      "tileable": true,
      "socketProfiles": ["interior_mixed_8x6", "interior_vertical_8x6"],
      "lodTriangleBudget": { "lod0": 18000, "lod1": 7000, "lod2": 2400 },
      "collision": { "kind": "primitive-plus-blockers", "maximumHulls": 10, "separateFromRenderMesh": true },
      "nav": { "walkable": true, "carvesNav": false, "mobility": ["infantry", "small_vehicle", "mech"], "clearanceRule": "The authored ramp is no steeper than 12 degrees and preserves 6.4 m width; lift platforms expose explicit nav links." },
      "damageStates": ["intact", "damaged", "destroyed"]
    },
    "door_4x4": {
      "category": "portal",
      "sizeMeters": [4, 4, 1],
      "pivot": "floor-center",
      "tileable": true,
      "socketProfiles": ["interior_personnel_4x4"],
      "lodTriangleBudget": { "lod0": 6000, "lod1": 2400, "lod2": 800 },
      "collision": { "kind": "box-compound", "maximumHulls": 4, "separateFromRenderMesh": true },
      "nav": { "walkable": false, "carvesNav": true, "mobility": ["infantry"], "clearanceRule": "Closed state blocks; open state clears 3.2 m by 3.2 m and never leaves invisible collision." },
      "damageStates": ["intact", "damaged", "destroyed"]
    },
    "gate_8x6": {
      "category": "portal",
      "sizeMeters": [8, 6, 1.5],
      "pivot": "floor-center",
      "tileable": true,
      "socketProfiles": ["interior_mixed_8x6"],
      "lodTriangleBudget": { "lod0": 10000, "lod1": 4000, "lod2": 1300 },
      "collision": { "kind": "box-compound", "maximumHulls": 6, "separateFromRenderMesh": true },
      "nav": { "walkable": false, "carvesNav": true, "mobility": ["infantry", "small_vehicle", "mech"], "clearanceRule": "Open state clears 6.4 m by 5.8 m; jammed state publishes the remaining clearance explicitly." },
      "damageStates": ["intact", "damaged", "destroyed"]
    },
    "cover_low_2m": {
      "category": "cover",
      "sizeMeters": [2, 1.2, 1],
      "pivot": "floor-center",
      "tileable": false,
      "socketProfiles": [],
      "lodTriangleBudget": { "lod0": 3000, "lod1": 1200, "lod2": 400 },
      "collision": { "kind": "box-compound", "maximumHulls": 3, "separateFromRenderMesh": true },
      "nav": { "walkable": false, "carvesNav": true, "mobility": ["infantry", "small_vehicle", "mech"], "clearanceRule": "Intact and damaged states carve their measured footprint; destroyed state uses a low rubble blocker no wider than 1.5 m." },
      "damageStates": ["intact", "damaged", "destroyed"]
    },
    "cover_large_4m": {
      "category": "cover",
      "sizeMeters": [4, 2, 1.5],
      "pivot": "floor-center",
      "tileable": false,
      "socketProfiles": [],
      "lodTriangleBudget": { "lod0": 5000, "lod1": 2000, "lod2": 650 },
      "collision": { "kind": "convex-compound", "maximumHulls": 4, "separateFromRenderMesh": true },
      "nav": { "walkable": false, "carvesNav": true, "mobility": ["infantry", "small_vehicle", "mech"], "clearanceRule": "Placement must leave either a 1.6 m infantry bypass or a 6.4 m mixed bypass; destroyed state may not seal the route." },
      "damageStates": ["intact", "damaged", "destroyed"]
    },
    "objective_console_3m": {
      "category": "objective",
      "sizeMeters": [3, 2.5, 2],
      "pivot": "floor-center",
      "tileable": false,
      "socketProfiles": [],
      "lodTriangleBudget": { "lod0": 7000, "lod1": 2800, "lod2": 900 },
      "collision": { "kind": "box-compound", "maximumHulls": 4, "separateFromRenderMesh": true },
      "nav": { "walkable": false, "carvesNav": true, "mobility": ["infantry"], "clearanceRule": "Provide one unobstructed 1.6 m interaction face and do not place inside the mixed-mobility lane." },
      "damageStates": ["intact", "damaged", "destroyed"]
    },
    "objective_machine_4m": {
      "category": "objective",
      "sizeMeters": [4, 4, 4],
      "pivot": "floor-center",
      "tileable": false,
      "socketProfiles": [],
      "lodTriangleBudget": { "lod0": 12000, "lod1": 4800, "lod2": 1600 },
      "collision": { "kind": "convex-compound", "maximumHulls": 6, "separateFromRenderMesh": true },
      "nav": { "walkable": false, "carvesNav": true, "mobility": ["infantry", "small_vehicle", "mech"], "clearanceRule": "Maintain two opposing infantry interaction faces and a 6.4 m vehicle/mech bypass in mixed rooms." },
      "damageStates": ["intact", "damaged", "destroyed"]
    },
    "landmark_8m": {
      "category": "landmark",